id,source_id,source_cutoff,question_text,trigger_span,answer_text,answer_span,answer_score,snippet_has_arg1_of,trigger_has_arg1_of,answer_has_arg2_of
investment.S147.Q3,investment,8288,Where do these people work? Fora government or private institution?,"[8105, 8120]",,,1.0,['Implicit:Comparison.Contrast'],['Implicit:Comparison.Contrast'],[]
investment.S166.Q3,investment,9399,Does this person like discussions of clean energy?,"[9384, 9397]",They seem to like talking about both sides of the climate change issue. ,"[9444.0, 9482.0]",3.0,['Implicit:Expansion.Conjunction'],['Implicit:Expansion.Conjunction'],"['Implicit:Expansion.Conjunction', 'Explicit:Contingency.Cause.Reason']"
investment.S168.Q3,investment,9484,Was the comic the thing poking fun at both sides?,"[9412, 9419]",,,1.0,"['Implicit:Expansion.Conjunction', 'Explicit:Expansion.Conjunction']","['Implicit:Expansion.Conjunction', 'Explicit:Expansion.Conjunction']",[]
investment.S170.Q3,investment,9641,How should we plan for the future?,"[9619, 9639]",,,1.0,['Explicit:Contingency.Cause.Reason'],['Explicit:Contingency.Cause.Reason'],[]
investment.S149.Q4,investment,8460,What is sustainability risk?,"[8335, 8354]",,,1.0,[],[],[]
investment.S151.Q3,investment,8675,What are the long term risks of inaction in this case?,"[8622, 8672]",,,1.0,[],[],[]
investment.S153.Q3,investment,8918,Is there any way to prove this?,"[8835, 8880]",,,1.0,['Implicit:Expansion.Exception.Arg2-as-excpt'],['Implicit:Expansion.Exception.Arg2-as-excpt'],[]
investment.S171.Q4,investment,9708,What kind of future are they planning?,"[9619, 9639]",,,1.0,[],[],[]
investment.S155.Q3,investment,9068,Is the cost of insurance worth it with these odds?,"[8992, 9038]",,,2.0,[],[],[]
investment.S157.Q3,investment,9127,What are these two things?,"[9078, 9125]",Creating insurance and not sacrificing performance.,"[9133.0, 9184.0]",4.0,['Implicit:Expansion.Level-of-detail.Arg2-as-detail'],['Implicit:Expansion.Level-of-detail.Arg2-as-detail'],['Implicit:Expansion.Level-of-detail.Arg2-as-detail']
investment.S163.Q3,investment,9281,How much is the risk reduced this way?,"[9153, 9203]",,,1.0,['NoRel:nan'],['NoRel:nan'],[]
investment.S49.Q1,investment,3532,What is ESG?,"[3322, 3387]",,,1.0,['Implicit:Expansion.Conjunction'],[],[]
investment.S161.Q3,investment,9365,In what way can we invest in sustainability? ,"[9081, 9102]",,,1.0,['NoRel:nan'],[],[]
investment.S17.Q4,investment,1320,What kind of emissions are responsible for this climate change?,"[1091, 1128]",,,1.0,['Explicit:Expansion.Conjunction'],[],[]
investment.S22.Q4,investment,1497,What do you want me to do?,"[1472, 1483]",,,1.0,"['Implicit:Expansion.Level-of-detail.Arg2-as-detail', 'Explicit:Expansion.Level-of-detail.Arg2-as-detail']",['Implicit:Expansion.Level-of-detail.Arg2-as-detail'],[]
investment.S24.Q4,investment,1617,Don't do what at home?,"[1497, 1518]",,,1.0,['Implicit:Expansion.Instantiation'],[],[]
investment.S26.Q4,investment,1826,How will the environmental change effect the financial data?,"[1699, 1726]",,,2.0,['Explicit:Expansion.Conjunction'],['Explicit:Expansion.Conjunction'],[]
investment.S54.Q1,investment,3800,What are they doing with the savings? ,"[3735, 3798]",,,1.0,['Explicit:Expansion.Conjunction'],['Explicit:Expansion.Conjunction'],[]
investment.S56.Q1,investment,3918,How do they decrease the emissions? ,"[3804, 3823]",,,1.0,['Explicit:Contingency.Cause+SpeechAct.Result+SpeechAct'],[],[]
investment.S58.Q1,investment,3965,What is Pentair?,"[3937, 3963]",a US industrial conglomerate,"[3976.0, 4006.0]",5.0,['EntRel:nan'],['EntRel:nan'],['EntRel:nan']
investment.S60.Q1,investment,4150,How much did Pentair save? ,"[4125, 4148]",,,1.0,[],[],[]
investment.S64.Q1,investment,4350,What level of growth did Pentair achieve? ,"[4231, 4271]",,,1.0,['EntRel:nan'],['EntRel:nan'],[]
investment.S68.Q1,investment,4488,Is there another relevant case?,"[4457, 4487]",,,2.0,['Implicit:Comparison.Concession.Arg2-as-denier'],['Implicit:Comparison.Concession.Arg2-as-denier'],[]
investment.S161.Q4,investment,9365,How are they investing sustainably?,"[9081, 9102]",,,1.0,['NoRel:nan'],[],[]
investment.S166.Q4,investment,9399,What do you like about it?,"[9384, 9397]",It pokes fun at both sides of the climate change issue.,"[9431.0, 9482.0]",5.0,['Implicit:Expansion.Conjunction'],['Implicit:Expansion.Conjunction'],"['Implicit:Expansion.Conjunction', 'Explicit:Contingency.Cause.Reason']"
investment.S168.Q4,investment,9484,How does it poke fun?,"[9431, 9440]",,,1.0,"['Implicit:Expansion.Conjunction', 'Explicit:Expansion.Conjunction']","['Implicit:Expansion.Conjunction', 'Explicit:Expansion.Conjunction']",[]
investment.S170.Q4,investment,9641,Do you like Mark Twain?,"[9592, 9602]",,,1.0,['Explicit:Contingency.Cause.Reason'],[],[]
investment.S1.Q5,investment,223,What are some of the biggest drivers of change?,"[184, 221]",,,2.0,['Explicit:Expansion.Level-of-detail.Arg2-as-detail'],['Explicit:Expansion.Level-of-detail.Arg2-as-detail'],[]
investment.S5.Q5,investment,385,What do environmental and social issues have to do with change?,"[327, 358]",Ignoring them can put expected returns in danger in the long run.,"[452.0, 487.0]",4.0,['Implicit:Expansion.Level-of-detail.Arg2-as-detail'],['Implicit:Expansion.Level-of-detail.Arg2-as-detail'],"['Implicit:Expansion.Level-of-detail.Arg2-as-detail', 'Explicit:Contingency.Cause+Belief.Reason+Belief']"
investment.S7.Q5,investment,489,Do long-term returns bring in more revenue than short term ones?,"[452, 479]",,,1.0,['Explicit:Expansion.Conjunction'],['Explicit:Expansion.Conjunction'],[]
investment.S11.Q5,investment,842,Why is sustainable investing so important?,"[806, 841]",An aging and expanding population,"[892.0, 932.0]",4.0,['NoRel:nan'],['NoRel:nan'],"['Implicit:Expansion.Level-of-detail.Arg2-as-detail', 'Explicit:Expansion.Conjunction']"
investment.S13.Q5,investment,1017,What does the population number have to do with investing?,"[942, 989]","Natural resource depletion, emissions, and climate change","[1133.0, 1147.0]",5.0,['Implicit:Expansion.Conjunction'],['Implicit:Expansion.Conjunction'],['Explicit:Expansion.Conjunction']
investment.S9.Q5,investment,693,Why does do institutional investors have more power to influence?,"[537, 573]",,,1.0,['Implicit:Expansion.Level-of-detail.Arg2-as-detail'],['Implicit:Expansion.Level-of-detail.Arg2-as-detail'],[]
investment.S158.Q4,investment,9281,How do you make sure you're not sacrificing performance?,"[9246, 9279]",,,1.0,['NoRel:nan'],['NoRel:nan'],[]
investment.S165.Q4,investment,9384,"What does the person like, the comic?","[9365, 9382]",I think they're talking about the comic but it's not spelled out.,"[9384.0, 9419.0]",3.0,['Implicit:Comparison.Similarity'],['Implicit:Comparison.Similarity'],"['Implicit:Comparison.Similarity', 'Implicit:Expansion.Conjunction']"
investment.S167.Q4,investment,9420,What do you like about it?,"[9384, 9419]",They like that it pokes fun at both sides of the issue instead of just one.,"[9420.0, 9454.0]",5.0,['Explicit:Contingency.Cause.Reason'],['Explicit:Contingency.Cause.Reason'],"['Implicit:Expansion.Conjunction', 'Explicit:Contingency.Cause.Reason']"
investment.S169.Q4,investment,9525,Which side are they on?,"[9500, 9523]",,,2.0,['Explicit:Expansion.Conjunction'],[],[]
investment.S133.Q4,investment,7524,How much is a lot?,"[7504, 7516]",over 77 trillion,"[7602.0, 7613.0]",4.0,['Implicit:Expansion.Instantiation'],['Implicit:Expansion.Instantiation'],['Implicit:Expansion.Conjunction']
investment.S135.Q4,investment,7615,"Besides global stock and global bond markets, what are some other potential investors?","[7528, 7547]",,,1.0,['Implicit:Contingency.Cause.Result'],['Implicit:Contingency.Cause.Result'],[]
investment.S137.Q4,investment,7731,How can we get them to invest?,"[7702, 7729]",Turn ESG into worthwhile transactions.,"[7910.0, 7940.0]",4.0,['Implicit:Expansion.Equivalence'],['Implicit:Expansion.Equivalence'],"['NoRel:nan', 'Explicit:Contingency.Condition.Arg2-as-cond']"
investment.S139.Q4,investment,7883,How can we get people to address these challenges?,"[7832, 7874]",give additional money to sustainable companies,"[7978.0, 8008.0]",4.0,['Explicit:Contingency.Condition.Arg2-as-cond'],['Explicit:Contingency.Condition.Arg2-as-cond'],['Implicit:Comparison.Concession.Arg2-as-denier']
investment.S126.Q4,investment,7472,How do we get institutional investors to invest?,"[7451, 7470]",,,1.0,['EntRel:nan'],['EntRel:nan'],[]
investment.S158.Q5,investment,9281,How do you invest in sustainably?,"[9081, 9102]",,,1.0,['NoRel:nan'],[],[]
investment.S165.Q5,investment,9384,What comic are you reading?,"[9289, 9294]",,,1.0,['Implicit:Comparison.Similarity'],[],[]
investment.S167.Q5,investment,9420,Why do you like it?,"[9410, 9419]",Because it pokes fun at both sides of the climate change issue.,"[9431.0, 9482.0]",5.0,['Explicit:Contingency.Cause.Reason'],['Explicit:Contingency.Cause.Reason'],"['Implicit:Expansion.Conjunction', 'Explicit:Contingency.Cause.Reason']"
investment.S169.Q5,investment,9525,Which side of the climate change issue are you on?,"[9506, 9523]",,,2.0,['Explicit:Expansion.Conjunction'],[],[]
investment.S19.Q5,investment,1246,What else is there?,"[1230, 1244]",The text meant that they're also economic issues.,"[1254.0, 1269.0]",5.0,['Implicit:Expansion.Level-of-detail.Arg2-as-detail'],['Implicit:Expansion.Level-of-detail.Arg2-as-detail'],['Implicit:Expansion.Level-of-detail.Arg2-as-detail']
investment.S141.Q4,investment,8105,How would this benefit investors?,"[8045, 8069]",,,1.0,['Implicit:Expansion.Conjunction'],['Implicit:Expansion.Conjunction'],[]
investment.S81.Q5,investment,5061,What does ESG stand for?,"[5056, 5059]",,,1.0,['Implicit:Expansion.Instantiation'],['Implicit:Expansion.Instantiation'],[]
investment.S86.Q5,investment,5310,What types of changes have they made to conserve energy?,"[5194, 5217]",,,1.0,['NoRel:nan'],[],[]
investment.S88.Q5,investment,5359,What is the strategy used in the correlation?,"[5326, 5337]",,,1.0,['Explicit:Comparison.Concession.Arg2-as-denier'],[],[]
investment.S90.Q5,investment,5538,Why aren't more companies using climate change strategies?,"[5511, 5537]",,,1.0,['Implicit:Expansion.Conjunction'],['Implicit:Expansion.Conjunction'],[]
investment.S125.Q5,investment,7395,Who are the institutional investors?,"[7335, 7358]",,,1.0,['Implicit:Contingency.Cause+SpeechAct.Result+SpeechAct'],['Implicit:Contingency.Cause+SpeechAct.Result+SpeechAct'],[]
investment.S131.Q5,investment,7472,Are they willing to invest the money that they have into saving the environment?,"[7465, 7470]",,,1.0,['EntRel:nan'],['EntRel:nan'],[]
investment.S171.Q5,investment,9708,What are you planning?,"[9619, 9639]",,,1.0,[],[],[]
investment.S109.Q4,investment,6564,What if a company only has two of the three?,"[6484, 6530]",,,1.0,['AltLex:Contingency.Cause+Belief.Result+Belief'],['AltLex:Contingency.Cause+Belief.Result+Belief'],[]
investment.S115.Q4,investment,6698,How do other investors see it?,"[6665, 6696]","others don't see the benefit, just the added work","[6712.0, 6748.0]",3.0,['Implicit:Expansion.Substitution.Arg2-as-subst'],['Implicit:Expansion.Substitution.Arg2-as-subst'],['Implicit:Expansion.Substitution.Arg2-as-subst']
investment.S101.Q4,investment,6022,Is this only available to Australians?,"[5987, 6021]",,,1.0,['NoRel:nan'],['NoRel:nan'],[]
investment.S103.Q4,investment,6156,Does CalPERS invest in ESG?,"[6022, 6048]",they are trying to get 100 percent sustainable investments,"[6237.0, 6293.0]",5.0,[],[],['Implicit:Expansion.Level-of-detail.Arg2-as-detail']
investment.S105.Q4,investment,6351,How long before they are at 100%?,"[6237, 6293]",,,1.0,[],[],[]
investment.S107.Q4,investment,6425,What do they think will happen to long term return with ESG?,"[6356, 6412]",,,1.0,['Implicit:Expansion.Level-of-detail.Arg2-as-detail'],['Implicit:Expansion.Level-of-detail.Arg2-as-detail'],[]
investment.S147.Q4,investment,8288,How will we remedy this situation?,"[8248, 8287]",,,1.0,['Implicit:Comparison.Contrast'],['Implicit:Comparison.Contrast'],[]
investment.S65.Q4,investment,4488,"What is the ""new New World""","[4329, 4347]",,,1.0,['Implicit:Comparison.Concession.Arg2-as-denier'],[],[]
investment.S70.Q4,investment,4592,How many companies pay attention to sustainability?,"[4516, 4550]",,,1.0,[],[],[]
investment.S72.Q4,investment,4720,Do sustainable companies attract different consumers?,"[4688, 4718]",,,1.0,['EntRel:nan'],['EntRel:nan'],[]
investment.S74.Q4,investment,4826,How about companies from undeveloped markets?,"[4775, 4807]",,,1.0,['Explicit:Comparison.Contrast'],['Explicit:Comparison.Contrast'],[]
investment.S76.Q4,investment,4958,Is there a tradeoff over a longer period?,"[4910, 4956]",,,1.0,['Explicit:Contingency.Cause+SpeechAct.Result+SpeechAct'],['Explicit:Contingency.Cause+SpeechAct.Result+SpeechAct'],[]
investment.S80.Q4,investment,4995,We want more companies or more information?,"[4981, 4993]",,,2.0,['Implicit:Expansion.Conjunction'],['Implicit:Expansion.Conjunction'],[]
investment.S84.Q4,investment,5061,Is there or isn't there outperformance from ESG?,"[5023, 5059]",They have out performed by about 2/3s over almost 8 years,"[5268.0, 5308.0]",5.0,['Implicit:Expansion.Instantiation'],['Implicit:Expansion.Instantiation'],['Implicit:Expansion.Level-of-detail.Arg2-as-detail']
investment.S94.Q4,investment,5967,What other kinds of companies are they invested in?,"[5855, 5899]",,,1.0,[],[],[]
investment.S56.Q2,investment,3918,What else are they doing to promote sustainability?,"[3860, 3916]",,,1.0,['Explicit:Contingency.Cause+SpeechAct.Result+SpeechAct'],['Explicit:Contingency.Cause+SpeechAct.Result+SpeechAct'],[]
investment.S58.Q2,investment,3965,What is the Pentair example?,"[3937, 3963]",They sold power tools and reinvested the funds in a water business,"[4074.0, 4123.0]",5.0,['EntRel:nan'],['EntRel:nan'],"['Explicit:Expansion.Conjunction', 'AltLex:Temporal.Asynchronous.Succession', 'Explicit:Expansion.Conjunction', 'Implicit:Temporal.Asynchronous.Precedence']"
investment.S60.Q2,investment,4150,Are there any more examples?,"[4125, 4148]",,,1.0,[],[],[]
investment.S64.Q2,investment,4350,What is the new world?,"[4329, 4348]",A world where resources are scarce,"[4357.0, 4404.0]",4.0,['EntRel:nan'],['EntRel:nan'],['EntRel:nan']
investment.S49.Q2,investment,3532,What type of company is this?,"[3352, 3355]",I don't know what type of company it is but I at least know that they are involved in automation.,"[3586.0, 3627.0]",3.0,['Implicit:Expansion.Conjunction'],[],"['AltLex:Expansion.Manner.Arg2-as-manner', 'AltLex:Hypophora', 'AltLex:Expansion.Instantiation', 'Implicit:Expansion.Conjunction', 'Explicit:Expansion.Conjunction']"
investment.S54.Q2,investment,3800,What are they doing with these savings?,"[3752, 3770]",,,1.0,['Explicit:Expansion.Conjunction'],['Explicit:Expansion.Conjunction'],[]
investment.S92.Q5,investment,5654,Is vanguard helping with investing in the climate change strategies?,"[5644, 5652]",,,1.0,['Implicit:Expansion.Instantiation'],['Implicit:Expansion.Instantiation'],[]
investment.S96.Q5,investment,5783,Is Hesta safe to invest in?,"[5661, 5666]",,,1.0,['Implicit:Expansion.Conjunction'],['Implicit:Expansion.Conjunction'],[]
investment.S100.Q5,investment,5987,What strategies are they investing in?,"[5881, 5899]",,,1.0,['Implicit:Contingency.Cause+SpeechAct.Result+SpeechAct'],['Implicit:Contingency.Cause+SpeechAct.Result+SpeechAct'],[]
investment.S68.Q2,investment,4488,What are the other companies doing things like this?,"[4457, 4487]",,,1.0,['Implicit:Comparison.Concession.Arg2-as-denier'],['Implicit:Comparison.Concession.Arg2-as-denier'],[]
investment.S58.Q3,investment,3965,What is Pentair doing?,"[3945, 3963]",They changed their business model.,"[4032.0, 4073.0]",5.0,['EntRel:nan'],['EntRel:nan'],"['Explicit:Expansion.Conjunction', 'AltLex:Temporal.Asynchronous.Succession']"
investment.S68.Q3,investment,4488,Are there going to be more examples?,"[4457, 4487]",,,1.0,['Implicit:Comparison.Concession.Arg2-as-denier'],['Implicit:Comparison.Concession.Arg2-as-denier'],[]
investment.S113.Q5,investment,6845,What job does this person have?,"[6642, 6659]",,,1.0,['Implicit:Comparison.Concession.Arg2-as-denier'],[],[]
investment.S60.Q3,investment,4150,We're they successful?,"[4125, 4148]",,,1.0,[],[],[]
investment.S64.Q3,investment,4350,What is the new New World?,"[4329, 4347]",The needs of the middle class.,"[4350.0, 4399.0]",4.0,['EntRel:nan'],['EntRel:nan'],['EntRel:nan']
investment.S110.Q5,investment,6698,What does ESG stand for?,"[6445, 6504]",,,1.0,['Implicit:Expansion.Substitution.Arg2-as-subst'],[],[]
investment.S117.Q5,investment,6951,How do they expect you to make the money?,"[6934, 6949]",,,1.0,[],[],[]
investment.S119.Q5,investment,7016,Why do they suggest giving the profits to charities?,"[6951, 6980]",,,1.0,['NoRel:nan'],[],[]
investment.S121.Q5,investment,7144,Who should hold the companies accountable for playing their part in sustaining the environment?,"[7124, 7142]",,,1.0,['Implicit:Contingency.Cause.Reason'],['Implicit:Contingency.Cause.Reason'],[]
investment.S123.Q5,investment,7290,How are they compatible?,"[7278, 7288]",,,1.0,['Explicit:Contingency.Cause+Belief.Result+Belief'],['Explicit:Contingency.Cause+Belief.Result+Belief'],[]
investment.S54.Q3,investment,3800,"Do these companies have employees that work from home, then?","[3660, 3681]",,,1.0,['Explicit:Expansion.Conjunction'],[],[]
investment.S142.Q5,investment,8288,What is ESG?,"[7910, 7940]",,,1.0,['Implicit:Comparison.Contrast'],[],[]
investment.S149.Q5,investment,8460,How do you define sustainability risk?,"[8318, 8375]",,,1.0,[],[],[]
investment.S124.Q5,investment,7331,How are investing and sustainability compatible?,"[7270, 7288]",Investors have money to promote sustainability,"[7451.0, 7470.0]",4.0,['Explicit:Comparison.Concession.Arg2-as-denier'],['Explicit:Comparison.Concession.Arg2-as-denier'],"['Implicit:Contingency.Cause.Reason', 'Implicit:Q/A']"
investment.S128.Q5,investment,7421,What can investors invest in to help sustainability?,"[7395, 7420]",,,1.0,"['Implicit:Contingency.Cause.Reason', 'Implicit:Q/A']","['Implicit:Contingency.Cause.Reason', 'Implicit:Q/A']",[]
investment.S132.Q5,investment,7496,How can you convince them to invest?,"[7483, 7494]",,,1.0,['AltLex:Expansion.Substitution.Arg2-as-subst'],['AltLex:Expansion.Substitution.Arg2-as-subst'],[]
investment.S151.Q4,investment,8675,What are the long range costs of inaction on clean water and air?,"[8622, 8672]",,,1.0,[],[],[]
investment.S153.Q4,investment,8918,What are the consensus on the odds?,"[8758, 8789]",,,1.0,['Implicit:Expansion.Exception.Arg2-as-excpt'],[],[]
investment.S155.Q4,investment,9068,What kind of insurance might there be for clean water and air?,"[8989, 9038]",investing sustainably could help,"[9078.0, 9126.0]",3.0,[],[],"['NoRel:nan', 'Explicit:Expansion.Manner.Arg2-as-manner', 'Explicit:Temporal.Synchronous']"
investment.S157.Q4,investment,9127,What are the two things that investing sustainably does?,"[9078, 9126]",creating insurance and not sacrificing performance,"[9246.0, 9280.0]",5.0,['Implicit:Expansion.Level-of-detail.Arg2-as-detail'],['Implicit:Expansion.Level-of-detail.Arg2-as-detail'],"['Implicit:Expansion.Level-of-detail.Arg2-as-detail', 'Explicit:Expansion.Conjunction', 'Explicit:Temporal.Synchronous']"
investment.S163.Q4,investment,9281,What are the risks to the economy?,"[9153, 9203]",,,1.0,['NoRel:nan'],['NoRel:nan'],[]
investment.S30.Q2,investment,2367,Which metric is most important?,"[1895, 1944]",,,1.0,['AltLex:Contingency.Cause+SpeechAct.Result+SpeechAct'],[],[]
investment.S37.Q2,investment,2560,Why is sustainable investing important?,"[2483, 2558]",It prevents future harm to people and the planet.,"[2593.0, 2629.0]",4.0,['AltLex:Expansion.Equivalence'],['AltLex:Expansion.Equivalence'],"['AltLex:Expansion.Equivalence', 'Explicit:Expansion.Manner.Arg2-as-manner']"
investment.S39.Q2,investment,2856,What are some examples of sustainable outcomes?,"[2675, 2728]",,,2.0,['EntRel:nan'],[],[]
investment.S41.Q2,investment,2997,Which CEOs are engaged in sustainable investing?,"[2892, 2905]",About 80% of CEOs see sustainability as crucial to their industry.,"[2997.0, 3028.0]",4.0,['Implicit:Expansion.Level-of-detail.Arg2-as-detail'],[],['Implicit:Expansion.Level-of-detail.Arg2-as-detail']
investment.S45.Q2,investment,3311,How much money has sustainable investing produced?,"[3261, 3309]",,,2.0,['Explicit:Contingency.Cause+SpeechAct.Result+SpeechAct'],['Explicit:Contingency.Cause+SpeechAct.Result+SpeechAct'],[]
investment.S51.Q2,investment,3432,What's a good example of ESG being used today?,"[3388, 3430]",The moved some applications to the cloud and retired others. They virtualized their OS environments.,"[3454.0, 3491.0]",3.0,[],[],"['AltLex:Expansion.Manner.Arg2-as-manner', 'AltLex:Hypophora', 'AltLex:Expansion.Instantiation']"
investment.S118.Q5,investment,6983,Why does that comment annoy you so much?,"[6845, 6888]",,,2.0,['EntRel:nan'],['EntRel:nan'],[]
investment.S120.Q5,investment,7061,What does he want to clarify?,"[7024, 7048]",He believes investors have limited social responsibility,"[7144.0, 7189.0]",4.0,['Implicit:Expansion.Level-of-detail.Arg2-as-detail'],['Implicit:Expansion.Level-of-detail.Arg2-as-detail'],['Implicit:Contingency.Cause.Reason']
investment.S122.Q5,investment,7270,What solution he is offering for sustainability?,"[7239, 7268]",,,1.0,['Implicit:Expansion.Substitution.Arg2-as-subst'],['Implicit:Expansion.Substitution.Arg2-as-subst'],[]
investment.S43.Q2,investment,3229,Who is the 7% that does not see ESG as important?,"[3142, 3164]",,,1.0,['Explicit:Contingency.Cause+SpeechAct.Result+SpeechAct'],['Explicit:Contingency.Cause+SpeechAct.Result+SpeechAct'],[]
investment.S49.Q3,investment,3532,What were the results of the migration to the cloud?,"[3441, 3503]",It allowed them to save 23 million in operating costs.,"[3741.0, 3770.0]",5.0,['Implicit:Expansion.Conjunction'],['Implicit:Expansion.Conjunction'],"['AltLex:Expansion.Manner.Arg2-as-manner', 'AltLex:Hypophora', 'AltLex:Expansion.Instantiation', 'AltLex:Contingency.Cause.Result', 'Explicit:Expansion.Conjunction', 'Implicit:Contingency.Cause.Result']"
investment.S54.Q4,investment,3800,What is the company doing with the reduced costs?,"[3741, 3789]",,,1.0,['Explicit:Expansion.Conjunction'],['Explicit:Expansion.Conjunction'],[]
investment.S56.Q3,investment,3918,How does this effect the people who drive for the company?,"[3892, 3916]",,,1.0,['Explicit:Contingency.Cause+SpeechAct.Result+SpeechAct'],['Explicit:Contingency.Cause+SpeechAct.Result+SpeechAct'],[]
investment.S30.Q3,investment,2367,What else should investors consider?,"[1895, 1924]","A long term, holistic view like this limits future risk.","[2569.0, 2608.0]",4.0,['AltLex:Contingency.Cause+SpeechAct.Result+SpeechAct'],[],"['AltLex:Expansion.Equivalence', 'Explicit:Expansion.Manner.Arg2-as-manner']"
investment.S37.Q3,investment,2560,Is one more important than the other?,"[2483, 2530]",,,2.0,['AltLex:Expansion.Equivalence'],['AltLex:Expansion.Equivalence'],[]
investment.S39.Q3,investment,2856,And is it?,"[2816, 2855]","Yes, mostly.","[2892.0, 2905.0]",5.0,['EntRel:nan'],['EntRel:nan'],['EntRel:nan']
investment.S41.Q3,investment,2997,Do you have some examples?,"[2892, 2905]",,,2.0,['Implicit:Expansion.Level-of-detail.Arg2-as-detail'],[],[]
investment.S43.Q3,investment,3229,And what does this mean for the future of business?,"[3146, 3178]",There are opportunities there.,"[3261.0, 3309.0]",4.0,['Explicit:Contingency.Cause+SpeechAct.Result+SpeechAct'],['Explicit:Contingency.Cause+SpeechAct.Result+SpeechAct'],['Implicit:Expansion.Equivalence']
investment.S45.Q3,investment,3311,How can we use that?,"[3261, 3309]",The text is about to tell us.,"[3388.0, 3399.0]",3.0,['Explicit:Contingency.Cause+SpeechAct.Result+SpeechAct'],['Explicit:Contingency.Cause+SpeechAct.Result+SpeechAct'],"['AltLex:Expansion.Manner.Arg2-as-manner', 'AltLex:Hypophora']"
investment.S51.Q3,investment,3432,And who is that?,"[3388, 3399]",State Street,"[3441.0, 3453.0]",5.0,[],[],"['AltLex:Expansion.Manner.Arg2-as-manner', 'AltLex:Hypophora', 'AltLex:Expansion.Instantiation']"
investment.S56.Q4,investment,3918,"What kind of companies are these that are avoiding the emissions of a 100,000 metric tons of carbon?","[3804, 3858]",Pentair is one of these companies and it has a water business.,"[4109.0, 4123.0]",3.0,['Explicit:Contingency.Cause+SpeechAct.Result+SpeechAct'],[],"['Explicit:Expansion.Conjunction', 'AltLex:Temporal.Asynchronous.Succession', 'Explicit:Expansion.Conjunction', 'Implicit:Temporal.Asynchronous.Precedence']"
investment.S58.Q4,investment,3965,What kind of company is Pentair?,"[3956, 3963]",Pentair is an industrial conglomerate that is in the U.S.,"[3965.0, 4006.0]",5.0,['EntRel:nan'],['EntRel:nan'],['EntRel:nan']
investment.S60.Q4,investment,4150,Why was Pentair's reinvesting a really big bet?,"[4125, 4148]",,,2.0,[],[],[]
investment.S64.Q4,investment,4350,Do they have anything else planned for the future?,"[4300, 4348]",,,1.0,['EntRel:nan'],['EntRel:nan'],[]
investment.S68.Q4,investment,4488,"What could be ""isolated cases""?","[4457, 4487]",Companies that consider sustainability.,"[4516.0, 4563.0]",3.0,['Implicit:Comparison.Concession.Arg2-as-denier'],['Implicit:Comparison.Concession.Arg2-as-denier'],['NoRel:nan']
investment.S58.Q5,investment,3965,What is Pentair?,"[3956, 3964]",A large coorperation,"[4109.0, 4123.0]",5.0,['EntRel:nan'],['EntRel:nan'],"['Explicit:Expansion.Conjunction', 'AltLex:Temporal.Asynchronous.Succession', 'Explicit:Expansion.Conjunction', 'Implicit:Temporal.Asynchronous.Precedence']"
investment.S60.Q5,investment,4150,Are they still in the water business?,"[4078, 4123]",,,2.0,[],[],[]
investment.S64.Q5,investment,4350,What do they mean by the New World?,"[4329, 4347]",,,1.0,['EntRel:nan'],['EntRel:nan'],[]
